url,page_type,reasoning
https://www.bulk.com/uk/products/complete-lean-mass-gainer/bble-clma,product_details_page,"The page provides detailed information about a single product, Lean Mass Gainer, including its price (£34.49), flavors, sizes, description, ingredients, and directions for use. It includes a clear action to buy the product."
https://www.bulk.com/uk/products/complete-lean-mass-strawberry-2-5kg-1/bble-clma-stra-2500-v2,product_details_page,"The page provides detailed information about a specific product, 'Lean Mass Gainer - Strawberry 2.5kg', including price details with a final price and a savings offer, as well as descriptions, benefits, directions, and ingredient information. It also includes an action to buy the product."
https://www.bulk.com/uk/products/complete-lean-mass-strawberry-5kg-1/bble-clma-stra-5000-v2,product_details_page,"The page offers a specific product (Lean Mass Gainer - Strawberry 5kg) for sale, includes a final price (£59.99), and contains a clear action to purchase or add to cart."
https://www.bulk.com/uk/products/complete-lean-masstm-strawberry-1kg-1/bble-clma-stra-1000-v2,product_details_page,"The page contains detailed information about a specific product, the Lean Mass Gainer - Strawberry 1kg, including a price, a description, ingredients, directions for use, and options to buy or add to cart."
https://www.bulk.com/uk/products/complete-mass-gainer/bble-cmas,product_details_page,"The page provides detailed information about a specific product, 'Mass Gainer', including its price, multiple buying options, flavors, and a clear call to action for purchasing the product."
